Variant,Description,OAPR Detector Score,Precision,Recall,F1,TP,FP,FN,Notes
cv_box_reranker_with_rfdetr_predicted_conditions,RF-DETR-aware reranker (privacy-weighted),0.912891,0.9075,0.9145,0.9110,2384,243,223,Recall-prioritizing option
error_hardened_all_raw_rf_iou0_45,Best error-hardened (RF on raw+RF-DETR candidates, IoU 0.45),0.917165,0.9319,0.9129,0.9223,2380,174,227,Primary detector policy for balanced OAPR
error_hardened_rfdetr_clean_logreg_iou0_45,Error-hardened on clean RF-DETR, logreg,0.915408,0.9081,0.9175,0.9128,2392,242,215,Strong recall variant
cv_box_reranker_predicted_conditions,Low-compute predecessor (no RF-DETR),0.9110,0.9310,0.9053,0.9179,2360,175,247,Useful for very low compute
fusion_yolo11s1280_scrfd10g_agreement,Strong high-recall fusion (pre-RF-DETR),0.9072,0.8877,0.9129,0.9002,2380,301,227,Supporting high-recall evidence
